{
  "$schema": "../../schemas/unit.schema.json",
  "uid": "01M5Z1YW0948EDNF3R7WHWTTS3",
  "kind": "function",
  "framework": "none",
  "name": "percent",
  "location": {
    "file": "site/src/lib/query.ts"
  },
  "versions": [
    {
      "contentHash": "git:131cb79b1c7a0b671528a88cf502e9e980cd74f8",
      "provisional": true,
      "parent": null,
      "change": "created",
      "actor": {
        "kind": "agent",
        "tool": "claude-code",
        "model": "claude-opus-5-5",
        "reviewed": false
      },
      "rationale": "Floors percentages so coverage never displays as met when it is not.",
      "links": [
        {
          "kind": "doc",
          "ref": "docs/demo.md"
        }
      ]
    }
  ],
  "tests": [
    {
      "file": "site/src/lib/query.test.ts",
      "via": "static"
    }
  ]
}
