{
  "$schema": "../../schemas/unit.schema.json",
  "uid": "01M5XDBC6ST4ATSSPWGG8KZ6B5",
  "kind": "function",
  "framework": "none",
  "name": "gitBlobHash",
  "location": {
    "file": "packages/core/src/hash.ts"
  },
  "versions": [
    {
      "contentHash": "git:0fc96813e0ce59ae112d2a0c69a5c8d876ce713a",
      "provisional": true,
      "parent": null,
      "change": "created",
      "actor": {
        "kind": "agent",
        "tool": "claude-code",
        "model": "claude-opus-5-5",
        "reviewed": false
      },
      "rationale": "Seed implementation from the plan (Core model); small enough to build and test on day one.",
      "links": [
        {
          "kind": "plan",
          "ref": "docs/plan.md#core-model"
        }
      ]
    }
  ],
  "docs": "The provisional hash used before the indexer exists: the git blob hash of a\nunit's source text, identical to `git hash-object --stdin`.",
  "tests": [
    {
      "file": "packages/core/src/hash.test.ts",
      "via": "static"
    }
  ]
}
