{
  "$schema": "../../schemas/unit.schema.json",
  "uid": "01M5XDBC8732J5QJGW9EV89JBN",
  "kind": "function",
  "framework": "none",
  "name": "parseUnit",
  "location": {
    "file": "packages/store/src/json-store.ts"
  },
  "versions": [
    {
      "contentHash": "git:d0dff59f1345b86a900936c2b645b6a84a2a7bb8",
      "provisional": true,
      "parent": null,
      "change": "created",
      "actor": {
        "kind": "agent",
        "tool": "claude-code",
        "model": "claude-opus-5-5",
        "reviewed": false
      },
      "rationale": "Seed implementation from the plan (Metadata schema and storage); small enough to build and test on day one.",
      "links": [
        {
          "kind": "plan",
          "ref": "docs/plan.md#metadata-schema-and-storage"
        }
      ]
    }
  ],
  "tests": [
    {
      "file": "packages/store/src/json-store.test.ts",
      "via": "static"
    }
  ]
}
