{
  "$schema": "../../schemas/unit.schema.json",
  "uid": "01M5XDBC7G50134G9MH89QGDRX",
  "kind": "function",
  "framework": "none",
  "name": "isUid",
  "location": {
    "file": "packages/core/src/uid.ts"
  },
  "versions": [
    {
      "contentHash": "git:20ff0fd56f5008e312929decc73c80384589a5b2",
      "provisional": true,
      "parent": null,
      "change": "created",
      "actor": {
        "kind": "agent",
        "tool": "claude-code",
        "model": "claude-opus-5-5",
        "reviewed": false
      },
      "rationale": "Seed implementation from the plan (Core model); small enough to build and test on day one.",
      "links": [
        {
          "kind": "plan",
          "ref": "docs/plan.md#core-model"
        }
      ]
    }
  ],
  "tests": [
    {
      "file": "packages/core/src/uid.test.ts",
      "via": "static"
    }
  ]
}
