{
  "$schema": "../../schemas/unit.schema.json",
  "uid": "01M5Z1F6N6QK49CWHHTZ40TRE6",
  "kind": "function",
  "framework": "none",
  "name": "readConfig",
  "location": {
    "file": "scripts/lib/config.ts"
  },
  "versions": [
    {
      "contentHash": "git:639f89590cd90089593914c72c018cff2900f99f",
      "provisional": true,
      "parent": null,
      "change": "created",
      "actor": {
        "kind": "agent",
        "tool": "claude-code",
        "model": "claude-opus-5-5",
        "reviewed": false
      },
      "rationale": "Reads .poetics/config.json for scope and policy.",
      "links": [
        {
          "kind": "decision",
          "ref": "docs/decisions/0007-change-check-and-coverage.md"
        }
      ]
    }
  ],
  "tests": [
    {
      "file": "scripts/check.test.ts",
      "via": "static"
    }
  ]
}
