{
  "$schema": "../../schemas/unit.schema.json",
  "uid": "01M5XDBC8407QXDZJZG6GGWVT1",
  "kind": "type",
  "framework": "none",
  "name": "UnitFile",
  "location": {
    "file": "packages/store/src/json-store.ts"
  },
  "versions": [
    {
      "contentHash": "git:371437a6509f2e5d0b853d284e7d5ab8a4cf644a",
      "provisional": true,
      "parent": null,
      "change": "created",
      "actor": {
        "kind": "agent",
        "tool": "claude-code",
        "model": "claude-opus-5-5",
        "reviewed": false
      },
      "rationale": "Seed type from the plan (Metadata schema and storage).",
      "links": [
        {
          "kind": "plan",
          "ref": "docs/plan.md#metadata-schema-and-storage"
        }
      ]
    }
  ],
  "tests": [
    {
      "file": "packages/store/src/json-store.test.ts",
      "via": "static"
    }
  ]
}
