{
  "$schema": "../../schemas/unit.schema.json",
  "uid": "01M5Z1F6N2W72KV89NHZA85J1J",
  "kind": "type",
  "framework": "none",
  "name": "ChangeReport",
  "location": {
    "file": "scripts/lib/change.ts"
  },
  "versions": [
    {
      "contentHash": "git:1b5f7af868d33cb2a71a0406cfafcb443e40f308",
      "provisional": true,
      "parent": null,
      "change": "created",
      "actor": {
        "kind": "agent",
        "tool": "claude-code",
        "model": "claude-opus-5-5",
        "reviewed": false
      },
      "rationale": "What the check looked at, so a clean result is distinguishable from an empty diff.",
      "links": [
        {
          "kind": "decision",
          "ref": "docs/decisions/0007-change-check-and-coverage.md"
        }
      ]
    }
  ],
  "tests": [
    {
      "file": "scripts/lib/change.test.ts",
      "via": "static"
    }
  ]
}
