{
  "$schema": "../../schemas/unit.schema.json",
  "uid": "01M5XDBC8MMX8HZ26P0EFRVYC3",
  "kind": "type",
  "framework": "none",
  "name": "ValidationResult",
  "location": {
    "file": "packages/store/src/schemas.ts"
  },
  "versions": [
    {
      "contentHash": "git:b7fab02d4be62efa21112c3e636cde4fe896320b",
      "provisional": true,
      "parent": null,
      "change": "created",
      "actor": {
        "kind": "agent",
        "tool": "claude-code",
        "model": "claude-opus-5-5",
        "reviewed": false
      },
      "rationale": "Seed type from the plan (Metadata schema and storage).",
      "links": [
        {
          "kind": "plan",
          "ref": "docs/plan.md#metadata-schema-and-storage"
        }
      ]
    }
  ],
  "tests": [
    {
      "file": "packages/store/src/schemas.test.ts",
      "via": "static"
    }
  ]
}
