{
  "$schema": "../../schemas/unit.schema.json",
  "uid": "01M5Z1YW07BCC36N8FPPW1D5M5",
  "kind": "function",
  "framework": "none",
  "name": "linkHref",
  "location": {
    "file": "site/src/lib/query.ts"
  },
  "versions": [
    {
      "contentHash": "git:ddf4259e21527647396bc2d6b45e2d70ef5119fe",
      "provisional": true,
      "parent": null,
      "change": "created",
      "actor": {
        "kind": "agent",
        "tool": "claude-code",
        "model": "claude-opus-5-5",
        "reviewed": false
      },
      "rationale": "Turns typed references (issues, PRs, commits, decisions, plan sections) into GitHub links.",
      "links": [
        {
          "kind": "doc",
          "ref": "docs/demo.md"
        }
      ]
    }
  ],
  "docs": "Where a link points, or undefined when it is a plain reference.",
  "tests": [
    {
      "file": "site/src/lib/query.test.ts",
      "via": "static"
    }
  ]
}
