{
  "$schema": "../../schemas/unit.schema.json",
  "uid": "01M5XDBC71JDZ5ANVBKKB168EW",
  "kind": "type",
  "framework": "none",
  "name": "ChangeClass",
  "location": {
    "file": "packages/core/src/types.ts"
  },
  "versions": [
    {
      "contentHash": "git:bca4afe89c2ffda230ee1f11a50984d77e25ea11",
      "provisional": true,
      "parent": null,
      "change": "created",
      "actor": {
        "kind": "agent",
        "tool": "claude-code",
        "model": "claude-opus-5-5",
        "reviewed": false
      },
      "rationale": "Seed type from the plan (Core model).",
      "links": [
        {
          "kind": "plan",
          "ref": "docs/plan.md#core-model"
        }
      ]
    },
    {
      "contentHash": "git:a6c6d99622deb48a0db784f0b3694b6fec440b42",
      "provisional": true,
      "parent": "git:bca4afe89c2ffda230ee1f11a50984d77e25ea11",
      "change": "interface",
      "actor": {
        "kind": "agent",
        "tool": "claude-code",
        "model": "claude-opus-5-5",
        "reviewed": false
      },
      "rationale": "Adds `removed` as the last-version change class, so deleting an export appends history instead of deleting the unit file. Code that switches exhaustively on ChangeClass must handle it.",
      "links": [
        {
          "kind": "decision",
          "ref": "docs/decisions/0010-removed-versions.md"
        }
      ]
    }
  ],
  "docs": "`created` marks a unit's first version and `removed` its last (ADR 0010);\nthe rest follow the plan's change classes.",
  "tests": [
    {
      "file": "packages/core/src/removal.test.ts",
      "via": "static"
    }
  ]
}
