{
  "$schema": "../../schemas/unit.schema.json",
  "uid": "01M5Z1F6NBW0WBH0P5EYCTFB52",
  "kind": "function",
  "framework": "none",
  "name": "computeCoverage",
  "location": {
    "file": "scripts/lib/coverage.ts"
  },
  "versions": [
    {
      "contentHash": "git:b3960e414b8180a152577ee1bf5cae095e07e8d4",
      "provisional": true,
      "parent": null,
      "change": "created",
      "actor": {
        "kind": "agent",
        "tool": "claude-code",
        "model": "claude-opus-5-5",
        "reviewed": false
      },
      "rationale": "Computes coverage metrics over scanned files and checks them against thresholds.",
      "links": [
        {
          "kind": "decision",
          "ref": "docs/decisions/0007-change-check-and-coverage.md"
        }
      ]
    }
  ],
  "tests": [
    {
      "file": "scripts/lib/coverage.test.ts",
      "via": "static"
    }
  ]
}
